[
  {
    "nazev_fotky": "18.7.2017-lonyn jidlo.JPG",
    "datum_fotky": "2017-07-27",
    "popis": "Každý den k jídlu nejlevnější sračky... \uD83D\uDE12"
  },
  {
    "nazev_fotky": "9.9.2017_Londýn všichni.jpg",
    "datum_fotky": "2017-09-28",
    "popis": "Návštěva tvého taťky a cizí lidi...Nemusíme zmiňovat, co se v tomto období dělo, byli jsme tam oba \uD83D\uDE02"
  },
  {
    "nazev_fotky": "24.9.2017-londyn dite.jpg",
    "datum_fotky": "2017-07-26",
    "popis": "Ubytování v mínus 30ti a řvoucí dítě. Všechno, co chceš \uD83D\uDE02 "
  },
  {
    "nazev_fotky": "25.9.2017-londyn pride.jpg",
    "datum_fotky": "2017-07-25",
    "popis": "Náš první a poslední pride \uD83D\uDE02, ale hlavně náš první výlet v Londýně!"
  },
  {
    "nazev_fotky": "26.9.2017_londyn svatek.jpg",
    "datum_fotky": "2017-08-26",
    "popis": "Občas jsme si i vyhodili z kopejtka, třeba na můj svátek"
  },
  {
    "nazev_fotky": "6.4.2019-příprava afrika.JPG",
    "datum_fotky": "2019-05-26",
    "popis": "Každý se připravoval jinak, ale já jsem chtěla mít hlavně padnoucí outfit \uD83D\uDE0E"
  },
  {
    "nazev_fotky": "24.5.2019_bakalar.JPG",
    "datum_fotky": "2019-05-24",
    "popis": "Dokončili jsme spolu bakaláře a chtěli se vydat na dobrodružství"
  },
  {
    "nazev_fotky": "25.5.2019_oslava po bakalari.JPG",
    "datum_fotky": "2019-05-25",
    "popis": "Nejdříve jsme trochu oslavovali s lidma, co neví, jestli jsou hetero nebo ne... A pak už byla příprava v plném proudu."
  },
  {
    "nazev_fotky": "6.7.2019_rwanda kámoši.jpeg",
    "datum_fotky": "2019-07-06",
    "popis": "Našli jsme si kámoše..."
  },
  {
    "nazev_fotky": "7.7.2019_rwanda pruvodce.jpeg",
    "datum_fotky": "2019-07-07",
    "popis": "...průvodce..."
  },
  {
    "nazev_fotky": "10.7.2019_Rwanda Paci.jpeg",
    "datum_fotky": "2019-07-10",
    "popis": "...a Paciho \uD83D\uDE02"
  },
  {
    "nazev_fotky": "12.7.2019_Etiopie kava.jpeg",
    "datum_fotky": "2019-08-28",
    "popis": "jsme měli čas na kávu a mezi tím, nás okrádali v hotelu \uD83D\uDE02"
  },
  {
    "nazev_fotky": "29.7.2019_zanzibar.JPG",
    "datum_fotky": "2019-08-05",
    "popis": "Pak jsme ale potřebovali trochu relax a Zanzibar nám ho dopřál..."
  },
  {
    "nazev_fotky": "1.8.2019_hrozný ubytko_Afrika.JPG",
    "datum_fotky": "2019-08-11",
    "popis": "...ale kdo by se na takové ubytko vracel \uD83D\uDE02"
  },
  {
    "nazev_fotky": "2.8.2019_tanzanie_liján.JPG",
    "datum_fotky": "2019-08-02",
    "popis": "Lítali jsme na lijánech v Tanzánii..."
  },
  {
    "nazev_fotky": "2.8.2019_zanzibar.JPG",
    "datum_fotky": "2019-08-08",
    "popis": "a pak řejezd na Pembu..."
  },
  {
    "nazev_fotky": "3.8.2019_Pemba záchrana.JPG",
    "datum_fotky": "2019-08-10",
    "popis": "kde jsme skoro zůstali \uD83D\uDE02"
  },
  {
    "nazev_fotky": "3.8.2019_tanzanie_nefotit.png",
    "datum_fotky": "2019-08-03",
    "popis": "fotili jsme se tam, kde jsme neměli..."
  },
  {
    "nazev_fotky": "4.8.2019_tanzánie_hry.png",
    "datum_fotky": "2019-08-04",
    "popis": "a hráli jsme hry s reálnýma penězma."
  },
  {
    "nazev_fotky": "5.8.2019_Tanzanie listky.png",
    "datum_fotky": "2019-08-13",
    "popis": "Dělali jsme si srandu z místních \uD83D\uDE02"
  },
  {
    "nazev_fotky": "5.8.2019_zanzibar.JPG",
    "datum_fotky": "2019-08-06",
    "popis": "bylo nám jako v ráji!"
  },
  {
    "nazev_fotky": "10.8.2019_Kenya.JPG",
    "datum_fotky": "2019-08-14",
    "popis": "a v Keni jsme navštívili Frančesku."
  },
  {
    "nazev_fotky": "15.8.2019_tanzanie_park.JPG",
    "datum_fotky": "2019-08-15",
    "popis": "Fotili jsme se všude \uD83D\uDE02"
  },
  {
    "nazev_fotky": "20.8.2019-etiopie vedro.JPG",
    "datum_fotky": "2019-09-04",
    "popis": "a bylo nám tu hrozné vedro."
  },
  {
    "nazev_fotky": "20.8.2019_etiopie znacka.png",
    "datum_fotky": "2019-09-03",
    "popis": "Značky tu moc nedávaly smysl..."
  },
  {
    "nazev_fotky": "21.8.2019_tanzanie_avokado.JPG",
    "datum_fotky": "2019-08-29",
    "popis": "Občas jsme si dali i něco dobrého."
  },
  {
    "nazev_fotky": "22.8.2019_etiopie slavnost.JPG",
    "datum_fotky": "2019-08-26",
    "popis": "Přejezd do Etiopie..."
  },
  {
    "nazev_fotky": "25.8.2019_tanzanie kongo.JPG",
    "datum_fotky": "2019-08-25",
    "popis": "Byli jsme skoro až u Konga..."
  },
  {
    "nazev_fotky": "2.9.2019_etiopie_noha.JPG",
    "datum_fotky": "2019-08-27",
    "popis": "tam se nám moc nedařilo, ale i přesto..."
  },
  {
    "nazev_fotky": "5.9.2019_uganda-brzda auto.JPG",
    "datum_fotky": "2019-07-02",
    "popis": "...v rozbitých dodávkách"
  },
  {
    "nazev_fotky": "11.9.2019_Uganda naramky.jpeg",
    "datum_fotky": "2019-09-11",
    "popis": "Dělali jsme radost..."
  },
  {
    "nazev_fotky": "12.9.2019_Uganda výroba jídla.jpeg",
    "datum_fotky": "2019-07-03",
    "popis": "...nebo vařili na ulici."
  },
  {
    "nazev_fotky": "13.9.2019_Uganda-korba.jpeg",
    "datum_fotky": "2019-07-01",
    "popis": "jezdili na korbě"
  },
  {
    "nazev_fotky": "14.9.2019_Uganda_musa rodina.jpeg",
    "datum_fotky": "2019-09-12",
    "popis": "oni dělali radost nám."
  },
  {
    "nazev_fotky": "14.9.2019_uganda johi banany.png",
    "datum_fotky": "2019-09-14",
    "popis": "sekaly banánovník..."
  },
  {
    "nazev_fotky": "14.9.2019_uganda martin kasava.png",
    "datum_fotky": "2019-09-13",
    "popis": "Kopali jsme kasavu..."
  },
  {
    "nazev_fotky": "15.9.2019_uganda pohreb.jpeg",
    "datum_fotky": "2019-09-15",
    "popis": "a byli na pohřbu cizích lidí \uD83D\uDE02"
  },
  {
    "nazev_fotky": "19.9.2019_tanzanie park motorka.jpg",
    "datum_fotky": "2019-08-22",
    "popis": "...nebo jak NEpadat na motorce v parku, kde jsou nebezpečná zvířata \uD83D\uDE02"
  },
  {
    "nazev_fotky": "19.9.2019_tanzanie trh.jpg",
    "datum_fotky": "2019-08-21",
    "popis": "jak smlouvat na tržišti..."
  },
  {
    "nazev_fotky": "19.9.2019_tanzanie-laska-tta.jpg",
    "datum_fotky": "2019-08-24",
    "popis": "Taky jsme si museli zahrát na pár \uD83D\uDE02"
  },
  {
    "nazev_fotky": "19.9.2019_tanzanie_koza dojeni.jpg",
    "datum_fotky": "2019-08-19",
    "popis": "Učila jsem se, jak dojit kozu..."
  },
  {
    "nazev_fotky": "22.7.2020_Rakousko hory.JPG",
    "datum_fotky": "2020-07-22",
    "popis": "jezdili na výlety..."
  },
  {
    "nazev_fotky": "3.1.2021_barcelona letiště.jpg",
    "datum_fotky": "2021-05-03",
    "popis": "Výlety ale nekončily..."
  },
  {
    "nazev_fotky": "3.1.2021_2_barcelona káva.jpg",
    "datum_fotky": "2021-05-05",
    "popis": "a my se bavili dál."
  },
  {
    "nazev_fotky": "16.4.2021_bezky.JPG",
    "datum_fotky": "2021-01-16",
    "popis": "Běžkovali jsme..."
  },
  {
    "nazev_fotky": "16.4.2021_hory_chata.jpg",
    "datum_fotky": "2021-01-17",
    "popis": "a byli na chatě."
  },
  {
    "nazev_fotky": "17.4.2021_bezky_2.JPG",
    "datum_fotky": "2021-01-17",
    "popis": "A pak zase běžkovali?"
  },
  {
    "nazev_fotky": "5.6.2021_Rakousko.JPG",
    "datum_fotky": "2021-06-05",
    "popis": "A poznávali jsme místa dál..."
  },
  {
    "nazev_fotky": "6.6.2021_Slovinsko všichni.JPG",
    "datum_fotky": "2021-06-06",
    "popis": "smáli se..."
  },
  {
    "nazev_fotky": "18.6.2021_Slovinsko vodopad.jpg",
    "datum_fotky": "2021-06-18",
    "popis": "koukali na vodopády..."
  },
  {
    "nazev_fotky": "18.6.2021_slovinsko raft.jpg",
    "datum_fotky": "2021-06-18",
    "popis": "jezdili na raftech..."
  },
  {
    "nazev_fotky": "20.6.2021_Slovinsko blinkání.jpeg",
    "datum_fotky": "2021-06-20",
    "popis": "a blinkali u silnice \uD83D\uDE02"
  },
  {
    "nazev_fotky": "1.7.2021_Uganda_musa house.jpeg",
    "datum_fotky": "2019-06-30",
    "popis": "Začali jsme v Ugandě s Musou..."
  },
  {
    "nazev_fotky": "9.7.2021_Panama_křen.JPG",
    "datum_fotky": "2021-07-09",
    "popis": "V Panamě jsem vám dělala křena.."
  },
  {
    "nazev_fotky": "10.7.2021-Panama_les.JPG",
    "datum_fotky": "2021-07-10",
    "popis": "všude..."
  },
  {
    "nazev_fotky": "12.7.2021_Panama ostrov.JPG",
    "datum_fotky": "2021-07-12",
    "popis": "zas a znovu \uD83D\uDE02"
  },
  {
    "nazev_fotky": "22.7.2021-rakousko motorka.jpg",
    "datum_fotky": "2021-07-22",
    "popis": "Rakousko jsme navštívili i na motorce..."
  },
  {
    "nazev_fotky": "13.8.2021-Bologna more.JPEG",
    "datum_fotky": "2021-08-13",
    "popis": "vykoupali jsme se v Bologně..."
  },
  {
    "nazev_fotky": "13.8.2021-Panama papouch.jpg",
    "datum_fotky": "2021-07-13",
    "popis": "viděli jsme papoucha..."
  },
  {
    "nazev_fotky": "13.8.2021_Panama parta.JPG",
    "datum_fotky": "2021-07-14",
    "popis": "kamarádili se s cizíma..."
  },
  {
    "nazev_fotky": "11.7.2022_rumunsko.jpeg",
    "datum_fotky": "2022-07-11",
    "popis": "I v Rumunsku jsme byli..."
  },
  {
    "nazev_fotky": "2015_PEFKA.png",
    "datum_fotky": "2015-09-29",
    "popis": "Tak tady to všechno začalo, naše společná cesta a hlavně dobrodružství"
  },
  {
    "nazev_fotky": "2019_konec afriky.png",
    "datum_fotky": "2019-09-30",
    "popis": "Takhle naše velké dobrodružství končilo..."
  },
  {
    "nazev_fotky": "2020_frisbe.jpeg",
    "datum_fotky": "2020-07-01",
    "popis": "Sportovali jsme spolu..."
  },
  {
    "nazev_fotky": "rohlik_2020.jpg",
    "datum_fotky": "2020-08-01",
    "popis": "a pak začala naše velká kariéra v Rohlíku, hlavně teda tobě \uD83D\uDE02"
  },
  {
    "nazev_fotky": "2021_Diplomka.jpeg",
    "datum_fotky": "2021-06-03",
    "popis": "Zase jsme to spolu dokončili \uD83D\uDE0D"
  },
  {
    "nazev_fotky": "voda-2023.jpeg",
    "datum_fotky": "2023-07-15",
    "popis": "Voda byla mokrá \uD83D\uDE02 hlavně pro nás dva..."
  }
]
